{
  "product_id": "P002",
  "analyzed_count": 57,
  "categories": [
    {
      "code": "SIZE_FIT",
      "label": "사이즈·핏 문제",
      "count": 22,
      "share_pct": 38.6
    },
    {
      "code": "CHANGE_OF_MIND",
      "label": "단순 변심",
      "count": 18,
      "share_pct": 31.6
    },
    {
      "code": "QUALITY_FINISH",
      "label": "봉제·마감 불만",
      "count": 5,
      "share_pct": 8.8
    },
    {
      "code": "COLOR_IMAGE",
      "label": "색상·이미지 차이",
      "count": 5,
      "share_pct": 8.8
    },
    {
      "code": "SHIPPING",
      "label": "배송·포장",
      "count": 3,
      "share_pct": 5.3
    },
    {
      "code": "OTHER",
      "label": "기타·판단 불확실",
      "count": 2,
      "share_pct": 3.5
    },
    {
      "code": "FABRIC_FEEL",
      "label": "원단·촉감·두께",
      "count": 1,
      "share_pct": 1.8
    },
    {
      "code": "DEFECTIVE",
      "label": "불량 제품",
      "count": 1,
      "share_pct": 1.8
    }
  ],
  "observed_facts": [
    {
      "statement": "사이즈·핏 불만(총 22건) 내에서 '품과 기장이 크다'는 의견(9건)과 '골반과 허리가 타이트하다' 또는 '작다'는 의견(13건)이 상충되어 나타납니다.",
      "evidence_quotes": [
        "생각보다 품이 너무 크고 기장도 어정쩡해요",
        "평소 M을 입는데 골반과 허리가 너무 타이트합니다",
        "사이즈가 작게 나와서 한 사이즈 큰 걸로 다시 사야겠어요"
      ],
      "evidence_order_ids": [
        "P002-20260626-0099",
        "P002-20260421-0426",
        "P002-20260908-0009"
      ]
    },
    {
      "statement": "봉제·마감 불만(QUALITY_FINISH, 5건)과 불량 제품(DEFECTIVE, 1건)을 합산하면 총 6건(10.5%)의 마감 및 제품 상태 문제가 보고되었습니다.",
      "evidence_quotes": [
        "실밥이 너무 지저분하게 튀어나와 있어요",
        "안쪽 마감 처리가 깔끔하지 못합니다",
        "지퍼 윗부분이 뻑뻑해서 잘 잠기지 않습니다"
      ],
      "evidence_order_ids": [
        "P002-20260718-0257",
        "P002-20260405-0507",
        "P002-20260409-1493"
      ]
    },
    {
      "statement": "실내 조명 환경에서 상품 사진과 실제 색감의 차이를 지적한 반품이 5건 확인됩니다.",
      "evidence_quotes": [
        "실내 조명에서 보면 사진과 색감 차이가 꽤 납니다"
      ],
      "evidence_order_ids": [
        "P002-20260706-0296",
        "P002-20260614-0745"
      ]
    },
    {
      "statement": "배송 지연 및 패키지 찌그러짐 등 물류 관련 사유가 3건 접수되었습니다.",
      "evidence_quotes": [
        "박스가 다 찌그러져서 상품 패키지가 손상되었습니다",
        "배송이 예상일보다 너무 늦어졌어요"
      ],
      "evidence_order_ids": [
        "P002-20260926-1537",
        "P002-20260805-0663"
      ]
    }
  ],
  "possible_causes": [
    {
      "statement": "와이드 팬츠 특유의 통/기장 치수에 비해 허리와 골반 단면이 상대적으로 좁게 설계되어 부위별 체형 체감 편차가 발생했을 가능성이 있습니다.",
      "confidence": "HIGH",
      "related_categories": [
        "SIZE_FIT"
      ]
    },
    {
      "statement": "상세페이지 내 실내 조명/자연광 환경별 색상 안내나 실제 원단 컬러 정보가 충분히 전달되지 않았을 가능성이 있습니다.",
      "confidence": "MEDIUM",
      "related_categories": [
        "COLOR_IMAGE"
      ]
    },
    {
      "statement": "봉제 마무리 단계의 실밥 정리나 지퍼 부자재 검수가 일부 미흡했을 가능성이 있습니다.",
      "confidence": "MEDIUM",
      "related_categories": [
        "QUALITY_FINISH",
        "DEFECTIVE"
      ]
    }
  ],
  "checks_needed": [
    "상품 상세페이지의 실측 사이즈 표에서 허리둘레, 엉덩이둘레, 허벅지단면, 밑위, 총기장 치수 표기가 정확한지 실물 치수와 대조 확인",
    "실내 조명과 자연광 아래에서 촬영된 실제 색상 비교 컷이 상세페이지에 포함되어 있는지 확인",
    "포장 및 출고 전 실밥 정리 및 지퍼 개폐 상태에 대한 검수 가이드라인 확인"
  ],
  "improvement_checklist": [
    {
      "title": "부위별 실측 사이즈 안내 및 체형별 핏 가이드 보강",
      "type": "PAGE_FIX",
      "rationale": "허리/골반은 타이트하고 통/기장은 크다는 상충된 피드백이 많으므로, 체형별 착용 핏과 밑위·골반 단면 실측 정보를 명확히 표기해 사이즈 오판을 방지합니다."
    },
    {
      "title": "실내 조명 및 실제 색감 상세 컷 추가",
      "type": "PAGE_FIX",
      "rationale": "조명 환경에 따른 색상 차이 언급이 5건 접수되었으므로, 보정 없는 근접 실물 컷과 실내광 사진을 추가해 고객의 기대치 차이를 줄입니다."
    },
    {
      "title": "출고 전 실밥 제거 및 지퍼 작동 상태 검수 기준 확인",
      "type": "PRODUCT_FIX",
      "rationale": "실밥 튀어나옴, 마감 불량, 지퍼 뻑뻑함 등 품질 관련 반품이 6건 접수되었으므로 출고 전 마무리 검수 단계를 점검할 필요가 있습니다."
    }
  ],
  "insufficient_data": false,
  "fallback": false,
  "cross_check": {
    "statement": "입고 검수에서 확인된 불량 10장 중 봉제·재봉(7장) 및 마감(2장)이 90%를 차지하며, 반품 데이터에서도 실밥·마감·지퍼 문제(총 6건)가 확인되어 불량 유형의 유사성이 관찰되나 동일 생산 물량인지 추가 확인이 필요합니다.",
    "confidence": "MEDIUM"
  },
  "period": {
    "from": "2026-01-10",
    "to": "2026-10-24"
  },
  "size_color_findings": [
    {
      "dimension": "size",
      "value": "L",
      "count": 22,
      "share_pct": 38.6
    },
    {
      "dimension": "size",
      "value": "M",
      "count": 20,
      "share_pct": 35.1
    },
    {
      "dimension": "size",
      "value": "XL",
      "count": 15,
      "share_pct": 26.3
    },
    {
      "dimension": "color",
      "value": "Blue",
      "count": 21,
      "share_pct": 36.8
    },
    {
      "dimension": "color",
      "value": "Black",
      "count": 20,
      "share_pct": 35.1
    },
    {
      "dimension": "color",
      "value": "Gray",
      "count": 16,
      "share_pct": 28.1
    }
  ]
}