{
  "product_id": "P007",
  "analyzed_count": 6,
  "categories": [
    {
      "code": "CHANGE_OF_MIND",
      "label": "단순 변심",
      "count": 3,
      "share_pct": 50.0
    },
    {
      "code": "SIZE_FIT",
      "label": "사이즈·핏 문제",
      "count": 2,
      "share_pct": 33.3
    },
    {
      "code": "QUALITY_FINISH",
      "label": "봉제·마감 불만",
      "count": 1,
      "share_pct": 16.7
    }
  ],
  "observed_facts": [
    {
      "statement": "사이즈가 작게 제작되었다는 의견과 특정 부위(골반 및 허리)가 타이트하다는 의견이 확인되었습니다.",
      "evidence_quotes": [
        "사이즈가 작게 나와서 한 사이즈 큰 걸로 다시 사야겠어요",
        "평소 M을 입는데 골반과 허리가 너무 타이트합니다"
      ],
      "evidence_order_ids": [
        "P007-20260621-1546",
        "P007-20260826-1732"
      ]
    },
    {
      "statement": "안쪽 마감 처리가 깔끔하지 못하다는 불만이 확인되었습니다.",
      "evidence_quotes": [
        "안쪽 마감 처리가 깔끔하지 못합니다"
      ],
      "evidence_order_ids": [
        "P007-20260309-0613"
      ]
    },
    {
      "statement": "단순 변심 사유로 선물 일정 취소, 타 색상 선호, 기대한 느낌과의 차이가 확인되었습니다.",
      "evidence_quotes": [
        "다른 색상이 더 나을 것 같아서 반품합니다",
        "선물하려고 했는데 일정이 취소되었어요",
        "실물을 보니 생각했던 느낌이 아니네요"
      ],
      "evidence_order_ids": [
        "P007-20260620-1003",
        "P007-20260422-1526",
        "P007-20260227-1863"
      ]
    }
  ],
  "possible_causes": [],
  "checks_needed": [
    "총 반품 건수(6건)가 적어 통계적 유의성이 부족하므로 반품 데이터가 더 축적된 후 재분석 검토",
    "상세 페이지의 사이즈 실측 가이드(밑단·허리 단면 등)와 실제 제작 치수의 일치 여부 확인",
    "입고 검수 시 안쪽 봉제 및 마감 불량 검수 기준 확인"
  ],
  "improvement_checklist": [],
  "insufficient_data": true,
  "fallback": false,
  "cross_check": {
    "statement": "입고 검수 불량 중 봉제·재봉(1장) 불량이 확인되었고 반품에서도 안쪽 마감 불만(1건)이 접수되었으나, 대상 물량이 같은지 확인되지 않아 동일 원인으로 단정하기 어렵습니다.",
    "confidence": "LOW"
  },
  "notes": [
    {
      "code": "SMALL_SAMPLE",
      "message": "총 반품 건수가 10건 미만이며 상품 문제 관련 반품이 5건 미만으로 표본이 부족하여 원인 분석 및 개선 체크리스트 제공을 보류합니다."
    }
  ],
  "period": {
    "from": "2026-01-10",
    "to": "2026-10-23"
  },
  "size_color_findings": [
    {
      "dimension": "size",
      "value": "XL",
      "count": 5,
      "share_pct": 83.3
    },
    {
      "dimension": "size",
      "value": "M",
      "count": 1,
      "share_pct": 16.7
    },
    {
      "dimension": "color",
      "value": "Black",
      "count": 4,
      "share_pct": 66.7
    },
    {
      "dimension": "color",
      "value": "Kaki",
      "count": 2,
      "share_pct": 33.3
    }
  ]
}